Risk ID,Risk Title,Risk Description,Category,Likelihood (1-5),Impact (1-5),Risk Score,Risk Level,Mitigation Strategy,Owner,Contingency Plan,Status
R-001,Staff resistance to digital process,"Claims handlers have used the same manual process for years. Adoption of a new digital workflow may face passive resistance, workarounds, or reversion to legacy practices after go-live.","People",4,4,16,High,"Run change impact assessment to identify highest-resistance roles before go-live. Involve two Claims Handlers (who flagged the Excel workarounds) as change champions. Deliver role-specific training using real claim scenarios, not generic system demos. Hold drop-in sessions for the first 3 weeks post-launch.","Change Manager / Operations Director","If adoption is below 70% after 4 weeks, implement mandatory digital-only submission cutover and withdraw paper forms from the office","Active — monitoring"
R-002,Finance system integration failure,"The Sage integration is the most technically complex element of the project. If the API integration fails or is delayed, the manual re-entry process continues, eliminating the largest efficiency saving.","Technology",3,5,15,High,"Require IT Lead to produce Sage integration specification in Sprint 1 before any other development begins. Build and test integration in a Sage sandbox environment before UAT. Schedule integration testing in Week 6 of the 10-week plan.","IT Lead","If integration is delayed beyond Week 8, implement a structured CSV import/export as interim data transfer to maintain process flow while integration is resolved","Active — monitoring"
R-003,Scope creep during build,"The board approved the Phase 1 scope. However, individual stakeholders may request additional features (mobile app, fraud analytics, third-party integrations) during development and delay the delivery timeline.","Delivery",4,3,12,High,"Maintain a formal change control log. Any request not in the approved MoSCoW Phase 1 scope must go through a written change request with impact assessment before being accepted. Operations Director has final approval authority on scope changes.","BA / Project Manager","If scope creep threatens the 10-week timeline, escalate to the Board with a revised timeline and cost estimate. Defer non-essential features to Phase 2 roadmap.","Active — monitoring"
R-004,Legacy system data migration errors,"Migrating claim history from the legacy system carries risk of data loss, duplication, or corruption — particularly for open claims in progress at the point of cutover.","Technology",3,4,12,High,"Complete a full data audit of the legacy system before migration planning begins. Define data mapping between old and new field structures. Run parallel operation for 2 weeks during cutover — all new claims on digital, all legacy claims processed in both systems.","IT Lead","Delay full cutover until data migration validation is complete. Maintain legacy system read-only access for 6 months post-migration for reference.","Active — monitoring"
R-005,Claimant digital exclusion,"A proportion of InsureRight claimants are older or less digitally confident and may be unable to use a web-based digital form without assistance.","People",3,3,9,Medium,"Retain a phone submission channel for claimants who cannot use the digital form. Agent completes the digital form on behalf of the claimant during the call. Include accessibility standards (WCAG 2.1 AA) in the platform requirements.","Operations Director","If exclusion complaints exceed 10% of submissions in Month 1, investigate and implement assisted digital service or a simplified mobile-first form variant.","Planned"
R-006,GDPR data handling compliance gap,"The new system will hold personal claimant data and sensitive medical information (for health claims). Any gap in data handling practice could result in a regulatory breach.","Compliance",2,5,10,High,"Engage Data Protection Officer in requirements review before build. Ensure Privacy Impact Assessment is completed before go-live. Define data retention periods and automated deletion rules in requirements (IR-017 covers secure messaging). Penetration test the portal before launch.","Data Protection Officer / IT Lead","If a breach is identified post-go-live, activate the ICO breach notification procedure within 72 hours as required by GDPR.","Planned"
R-007,Supplier delivery delay,"If the selected technology supplier is unable to deliver to the agreed 10-week schedule, the transformation timeline slips and the board-approved £320K budget becomes at risk.","Delivery",2,4,8,Medium,"Include milestone-based payment terms in supplier contract. Require weekly progress reports from Week 2. Define clear go/no-go criteria at Week 5 midpoint. Include penalty clauses for milestone slippage in contract negotiation.","Project Manager","If supplier is more than 2 weeks behind at the Week 5 checkpoint, assess whether an alternative supplier or in-house build is viable within budget. Escalate to Board.","Planned"
R-008,Benefits not realised post-go-live,"The board approved the business case on projected savings of £1.09M per year and a payback period under 6 months. If actual adoption or process efficiency does not meet projections, the business case is undermined.","Business",2,4,8,Medium,"Define the 5 KPIs from the Benefits Realisation Plan before go-live and assign owners. Measure baseline from the current system in the 4 weeks before cutover. Produce the first monthly performance report at Week 6 post-launch. Review at 3-month and 6-month intervals and report to Board.","Operations Director / BA","If KPIs at 3 months are below 60% of target, convene a benefits review with the Operations Director and identify whether it is an adoption issue (people), process issue, or system issue before prescribing a fix.","Planned"
